Object URL,Social Tags,C,CS,CSH,GV,AR,BM,MCS
https://collectionapi.metmuseum.org/api/collection/v1/iiif/199737/1372219/main-image,N/A,"art, pottery, no person, design, round, ornate, round out, decoration, tableware, porcelain, illustration, handmade, pattern, shape, ceramic, dish, earthenware, plate, antique, artistic",round white and blue ceramic plate,round multicolored ceramic plate decor,"Dishware, Porcelain, Plate, Ceramic, Tableware, Platter, Circle, Serveware, earthenware, Emblem","Pottery, Art, Porcelain, Bowl, Rug, Saucer","majolica earthenware, earthenware, utensil, faience eartherware, ultramarine color, jade green color","a gold coin, utensil, colorful, decorated, white, black, large, red, gold, painted, blue, yellow"
https://collectionapi.metmuseum.org/api/collection/v1/iiif/282043/608594/main-image,N/A,"portrait, people, art, one, lid, adult, veil, wear, man, cap, woman, military, profile, facial hair, vintage, painting, sepia, retro, royalty, military uniform",man wearing black suit jacket photo,woman wearing headband,"Photograph, Art, Headgear, History, Vintage clothing, Photography","Person, Human, Face, Head, Photography, Portrait, Photo, Accessories, Accessory, Jewelry, Archaeology","passe-partout (frame), framework, supporting structure, frame, picture frame, book, book jacket, wrapping, maroon color","a black and white photo of a person, photo, black, white, monitor, sitting, woman, old, food, holding, man, standing, cat"
https://collectionapi.metmuseum.org/api/collection/v1/iiif/488030/1006992/restricted,N/A,"no person, landscape, nature, mountain, hill, tree, outdoors, valley, scenic, agriculture, dawn, travel, sky, grass, countryside, farm, rural, cropland, sunset, field",brown and green trees painting,green leaf tree,"Painting, Nature, Sky, Natural landscape, Hill, Watercolor paint, Rural area, Plain, Landscape, Acrylic paint","Painting, Art, Nature, Outdoors, Countryside, Building, Rural, Housing, Landscape, Scenery, Field, Farm, House, Grassland, Hut","oil paint, paint, hay, fodder, feed, food, slope, natural elevation, olive green color, ultramarine color","a waterfall with a mountain in the background, grass, mountain, nature, outdoor, sheep, field, water, rock, large, grazing, view, waterfall, old, green, standing, rocky, horse, many, hill, covered, herd, grassy, man, flock, river"
https://collectionapi.metmuseum.org/api/collection/v1/iiif/444897/898260/main-image,N/A,"no person, illustration, art, desktop, design, paper, vintage, decoration, abstract, retro, symbol, card, pattern, color, one, flower, texture, still life, container, cutout","white, blue, and green floral textile","white, orange and blue floral board","Blue, Pattern, Design, Textile, Visual arts","Porcelain, Art, Pottery, Pattern, Rug, Embroidery, Graphics, Floral Design","clutch bag, handbag, purse, bag, etui (ladies bag), pencil box, box, cardcase, utensil, food, fabric, ultramarine color","thing, decorated, sitting, table, colorful, blue, white, side, large, yellow, board, red, vase"
https://collectionapi.metmuseum.org/api/collection/v1/iiif/470599/1563186/main-image,N/A,"sculpture, statue, art, museum, monument, old, travel, architecture, marble, stone, ancient, building, grave, religion, urban, city, church, cemetery, lion, god",offensive,knight statue,"Sculpture, Statue, Classical sculpture, Art, Stone carving, Carving, Relief, Museum, Visual arts, Marble","Soil, Archaeology, Flagstone","sarcophagus  coffin, box, memorial, stele (stone slab with markings), gargoyle (water spout), alabaster color","building, stuffed, sitting, teddy, sidewalk, bear, laying, food, table, floor, lying, feet, dog, holding, large, board, baby, man, cutting, standing, kitchen, street, white, stone"
https://collectionapi.metmuseum.org/api/collection/v1/iiif/337496/739534/main-image,N/A,"portrait, face, old, art, people, woman, man, one, eye, girl, texture, hair, vintage, paper, fashion, sepia, antique, desktop, adult, person",black and white abstract painting,womans face,"Face, Hair, Head, Forehead, Facial hair, Portrait, Eyebrow, Nose, Chin, Self-portrait","Art, Head, Painting, Human, Person, Face, Drawing, Photo, Photography, Portrait, Sketch","person, silverpoint, gray color, ash grey color","a person looking at the camera, text, book, photo, looking, man, old, sitting, young, white, cat, standing"
https://collectionapi.metmuseum.org/api/collection/v1/iiif/591854/1229683/restricted,N/A,"art, illustration, house, painting, print, people, no person, bird, lamp, architecture, building, family, room, vintage, furniture, wood, window, old, lithograph, woman",brown wooden framed wall decor,brown bird house illustration,"Illustration, Painting, Art, Visual arts","Art, Painting, Tower, Building, Clock Tower, Architecture, Human, Person, Drawing","cuckoo clock, clock, timepiece, measuring instrument, Kachina dolls, shadow box, box, light brown color, dark red color","a bedroom with a bed and a mirror, indoor, photo, sitting, small, items, mirror, table, room, various, old, brown, cat, black, bed, man, living, hanging, laying, clock, sink, bedroom, kitchen, white, holding, stove, display, sleeping"
https://collectionapi.metmuseum.org/api/collection/v1/iiif/553045/1212488/main-image,N/A,"no person, sculpture, carpentry, art, metalwork, one, ancient, figurine, wood, antique, retro, figure, old, people, steel, woman, statue, arts and crafts, traditional, man",brass-colored metal frame,gray and brown figurine,"Sculpture, Statue, Bronze sculpture, Figurine, Art, Bronze, Metal, Monument, Antique, Nonbuilding structure","Toy, Architecture, Building, Bronze, Symbol, Emblem, Column, Pillar, Figurine, Person, Human, Totem, Tiki","reliquary container, oil lamp, lamp, safety lamp, mouthpiece, acoustic device, controller, game equipment, alabaster color, ultramarine color","thing, indoor, sitting, table, clock, wooden, brown, tall, orange, large, display, standing, cat, vase, holding"
https://collectionapi.metmuseum.org/api/collection/v1/iiif/107375/272802/main-image,N/A,"fashion, winter, portrait, woman, wear, leather, studio, man, model, art, adult, dress, traditional, jacket, retro, costume, girl, one, elegant, Christmas",womens red and brown long sleeve dress,red and gold traditional dress on white background,"Clothing, Outerwear, Red, Sleeve, Maroon, Robe, Fur, Coat, Velvet, Jacket","Clothing, Apparel, Costume, Overcoat, Coat, Person, Human, Sleeve, Long Sleeve, Toy, Fashion, Doll","fur, garment, overgarment, jabot (ruffle of dress), dolman jacket, coat, coating, clothing, fabric, dark red color, Indian red color","a woman wearing a red dress standing in front of a coat, red, person, coat, clothing, wearing, woman, dressed, phone, cellphone, dress, looking, jacket, lady, hat, standing, outfit, walking, snow, holding, talking, suit, field, covered, large, white, head, shirt, street, skiing, umbrella, man"
https://collectionapi.metmuseum.org/api/collection/v1/iiif/544692/1212612/main-image,N/A,"sculpture, art, statue, ancient, Buddha, religion, no person, temple, veil, travel, old, god, figurine, culture, museum, archaeology, grave, antique, spirituality, stone",gray and black ceramic figurine,concrete statue,"Sculpture, Statue, Stone carving, Classical sculpture, Art, Forehead, Monument, Artifact, Stock photography, Temple","Person, Human, Sculpture, Art, Statue, Archaeology, Figurine, Kneeling","socle, support, supporting structure, stele (stone slab with markings), ancient person, person, sculpture, alabaster color","a statue of a person, old, sitting, standing, man, suit, wearing, green, brown, gray, clock, tower, statue, large, tall, stone, hat, luggage, brick, white, stacked"
https://collectionapi.metmuseum.org/api/collection/v1/iiif/39733/147899/main-image,N/A,"art, pattern, decoration, flower, texture, retro, design, desktop, abstract, vintage, antique, floral, illustration, textile, style, old, handicraft, fabric, ornate, handmade","green, red, and yellow floral textile",brown and green dragon graphic carpet,"Pattern, Textile, Motif, Visual arts, Art, Paisley, Rug, Pattern","Rug, Pattern, Art, Applique, Paisley","tapestry, fabric, rug, floor cover, scatter rug, paisley fabric, olive green color","a fabric surface, clothing, fabric, rug"
https://collectionapi.metmuseum.org/api/collection/v1/iiif/11383/34354/main-image,N/A,"art, vintage, painting, lid, people, one, retro, man, fall, tree, woman, old, portrait, adult, antique, nature, illustration, wear, veil, color",man in black suit painting,man wearing magician hat painting,"Painting, Lady, Portrait, Art, Standing, Visual arts, Self-portrait, Artist","Clothing, Apparel, Human, Person, Painting, Art, People, Hat","golf, athletic game, sport, cassock, gown, outerwear, frock coat, coat, overgarment, garment, person, clothing, olive green color, coal black color","a man that is standing in the grass, grass, man, outdoor, person, standing, field, building, cellphone, phone, holding, wearing, black, walking, young, park, baseball, street, ball, white"
https://collectionapi.metmuseum.org/api/collection/v1/iiif/469949/941522/main-image,N/A,"sculpture, art, mammal, no person, lion, statue, museum, figurine, bronze, animal, metalwork, deer, ancient, one, dog, cavalry, nude, wildlife, illustration, reindeer",brown wooden horse head figurine,brass-colored lion figurine,"Sculpture, Bronze sculpture, Animal figure, Metal, Bronze, Brass, Figurine, Canidae, Carnivore, Ancient dog breeds","Figurine, Bronze, Mammal, Wildlife, Animal, Antelope, Horse, Art, Sculpture, Musical Instrument, Brass Section, Cushion, Wood, Furniture","andiron (used in fireplace), support, gilt (golden faced), coating, saber-toothed tiger, big cat, feline, carnivore, mammal, animal, artifact, light brown color","a close up of a dog, dog, brown, sitting, zebra, standing, playing, man"
https://collectionapi.metmuseum.org/api/collection/v1/iiif/24927/1710189/main-image,N/A,"weapon, gun, still life, art, no person, vintage, cutout, retro, pistol, old, one, studio, metalwork, antique, wear, furniture, steel, mammal, military, people",white and brown wooden ship scale model,two white flintlocks,"Gun, Firearm, Bow and arrow, Trigger, Ranged weapon, Rifle, Bow, Wood, Crossbow, Shotgun","Weapon, Weaponry, Gun, Handgun, Rifle","flintlock gun, matchlock, muzzle loader gun, firearm, gun, weapon, alabaster color","a close up of a gun, thing, gun, weapon, sitting, table, small, water, black, boat, laying, air, white"
https://collectionapi.metmuseum.org/api/collection/v1/iiif/444540/898286/main-image,N/A,"no person, metalwork, art, furniture, antique, gold, ornate, luxury, gilt, ancient, bronze, carpentry, wealth, old, brass, baroque, classic, castle, architecture, victorian",brown wooden wall mount rack,brass-colored container,"Table, Furniture, Brass, Metal, Bronze, Antique, Coffee table, End table, Games, Miniature","Furniture, Treasure, Cabinet, Bronze, Tabletop, Gold, Crib","settee (bench), bench, seat, furniture, Sheraton furniture, dressing table, table, sideboard (counter), reddish brown color, olive green color","a gold clock sitting on top of a table, table, small, metal, gold, sitting, clock, hanging, room, old, white, water, standing"
https://collectionapi.metmuseum.org/api/collection/v1/iiif/435839/1763010/main-image,N/A,"architecture, travel, building, art, people, city, street, group, cathedral, church, tower, religion, bridge, many, no person, plaza, town, urban, sunset, sky",brown wooden framed painting of house,"Venice- 16th Cenutry, Othello by Emma Thornton on Prezi","Landmark, City, Human settlement, Public space, Town square, Town, Architecture, Building, Clock tower, Plaza","Building, Architecture, Person, Human, Art, Painting, Tower, Urban, Town, City, Downtown, Lighthouse, Beacon, Temple, Shrine, Worship, Landscape, Nature, Panoramic, Outdoors, Scenery, Bell Tower, Column, Pillar","religious building, building, belfry tower, tower, mecca, blue color","a group of people walking in front of Piazza San Marco, building, outdoor, standing, walking, sheep, city, large, group, people, front, snow, horse, clock, old, rug, street, man, many, riding, tower, water, flock, herd"
https://collectionapi.metmuseum.org/api/collection/v1/iiif/451023/904153/main-image,N/A,"illustration, art, religion, god, narrative, vintage, painting, picture frame, retro, aura, old, ancient, woman, desktop, culture, spirituality, manuscript, design, baby, style",woman in white dress painting,woman and man painting,"Painting, Art, Illustration, Miniature, Visual arts, Fictional character","Human, Person, Art, Mail, Envelope, Painting, Prayer, Worship, Greeting Card","tapestry, fabric, picture frame, framework, supporting structure, shadow box, box, light brown color, beige color","a close up of a book, text, photo, old, sitting, book, table, suitcase, luggage, brown, bear, computer, stuffed"
https://collectionapi.metmuseum.org/api/collection/v1/iiif/207667/436330/main-image,N/A,"furniture, metalwork, no person, art, ornate, antique, inlay, carpentry, painting, wood, gold, container, decoration, cabinet, ancient, one, illustration, ebony, old, bronze",brown wooden single pedestal desk,brown and black wooden cabinet,"Furniture, Antique, Table, Desk, Napoleon iii style, Nightstand, End table, Drawer","Furniture, Sideboard, Table, Desk, Tabletop, Cabinet, Drawer","lowboy, furniture, davenport desk, table, marquetry (veneers), boulle (furniture), reddish brown color","a wooden table, indoor, table, small, old, sitting, wooden, room, bed, living, large, carriage"
https://collectionapi.metmuseum.org/api/collection/v1/iiif/9982/44110/main-image,N/A,"no person, glass, glass items, still life, wine, H2O, bottle, trophy, vodka, reflection, victory, antique, drink, empty, cup, retro, luxury, classic, container, old",clear glass base table lamp,clear glass footed beverage dispenser,"Product, Glass, Still life photography, Metal, Barware, Silver, Silver","Lamp, Glass, Lantern, Goblet, Lighting","censer container, samovar urn, pot, porringer bowl, bowl, tableware, utensil, oil lamp, lamp, gray color, ivory color","a tall glass vase on a table, indoor, table, sitting, small, vase, glass, black, lamp, white, clock, desk, flower, holding, clear, bottle, display, room, tall"
https://collectionapi.metmuseum.org/api/collection/v1/iiif/488570/1017246/restricted,N/A,"people, illustration, no person, education, man, school, art, furniture, indoors, wood, painting, business, print, room, travel, container, chalk, adult, study, retro",brown wooden framed wall decor,black 3-panel wooden room divider with art,"Modern art, Art, Banner, Furniture, Calligraphy, Room divider, Visual arts, Metal, Rectangle","Electronics, Screen, Monitor, Display, Advertisement, LCD Screen, Billboard, Shop","screen, indoors, marquetry (veneers), multi panel pictures/art, passe-partout (frame), framework, supporting structure, pale yellow color","a close up of a sign, room, photo, black, table, wooden, sign, refrigerator, kitchen, computer"
https://collectionapi.metmuseum.org/api/collection/v1/iiif/44859/150925/main-image,N/A,"retro, no person, antique, classic, leather, container, handmade, vintage, old, elegant, handle, luxury, style, wood, arts and crafts, fashion, art, isolated, one, brass",brown and black floral leather tote bag,gold and black floral watering can,"Bag, Handbag, Brown, Fashion accessory, Shoulder bag","Bag, Accessories, Accessory, Handbag, Watering Can, Can, Tin, Pottery, Pot","handbag, coal scuttle, carpetbag, traveling bag, luggage, purse, bag, accessory, clothing, light brown color, beige color","indoor, table, sitting, cup, small, coffee, piece, decorated, vase, wooden, black, flower, cake, banana, plate, bag, fruit, board, water, white"
https://collectionapi.metmuseum.org/api/collection/v1/iiif/437372/795959/main-image,N/A,"saint, religion, art, Mary, church, painting, god, kneeling, people, book, cross, chapel, veil, cathedral, throne, aura, group, Apostle, Renaissance, gown (clothing)",brown wooden framed wall decor,Religious painting,"Holy places, Painting, Architecture, Art, Altar, History, Stock photography, Statue, Middle ages, Arch","Person, Human, Art, Painting, Architecture, Building, Altar, Church","person, altarpiece, screen, indoors, Indian red color, alabaster color","a group of people sitting on a bench posing for the camera, building, bench, sitting, photo, standing, man, people, group, posing, wooden, old, water, woman"
https://collectionapi.metmuseum.org/api/collection/v1/iiif/505786/1024220/main-image,N/A,"classical music, violin, no person, classic, music, wood, artistic, instrument, art, bowed stringed instrument, sound, cello, orchestra, musician, antique, viola, retro, carpentry, one, old",brown and black violin with bow,brown violin,"String instrument, Musical instrument, String instrument, Violin, Viola, Violin family, Bowed string instrument, Cello, Violone, Viol","Leisure Activities, Musical Instrument, Violin, Fiddle, Viola, Cello, Guitar","viol, bowed stringed instrument, stringed instrument, musical instrument, viola da gamba, ""viola damore"", viola, reddish brown color","a close up of a violin, instrument, music, violin, brown, cello, orange"
https://collectionapi.metmuseum.org/api/collection/v1/iiif/337500/787246/main-image,N/A,"art, people, woman, painting, print, portrait, vintage, nude, one, baby, retro, adult, illustration, decoration, furniture, antique, interior, girl, family, old",womens black hair,woman combing her hair holding hand mirror painting,"Painting, Lady, Art, Picture frame, Fictional character, Still life, Photography, Long hair, Visual arts, Modern art","Art, Painting, Human, Person","painting, oil paint, paint, kisser, person, beige color","a person holding a cat, indoor, person, sitting, looking, cat, holding, man, woman, brown, hair, playing, phone, dog, mouth, white, teeth, laying, room, bed, standing, brushing, stuffed"
https://collectionapi.metmuseum.org/api/collection/v1/iiif/453683/906096/main-image,N/A,"illustration, art, painting, print, fish, animal, people, prehistoric, bird, ancient, old, engraving, vintage, pattern, design, mammal, religion, elephant, antique, symbol",blue and brown wooden wall decor,painting of angel over fish,"Painting, Art, Illustration, Visual arts, History, Fictional character, Prophet, Tapestry","Art, Painting, Person, Human, Clothing, Apparel, Drawing","tapestry, fabric, rug, floor cover, beige color, olive green color","a painting of a book, text, book, photo, sitting, holding, old, painting, man, stuffed, woman, table, elephant, bed, bear, laying, people, riding"
https://collectionapi.metmuseum.org/api/collection/v1/iiif/17053/33779/main-image,N/A,"water, watercraft, boat, fisherman, rowboat, transportation system, fishing boat, travel, sea, people, vehicle, ocean, canoe, beach, ship, seashore, river, lake, no person, fish",brown and white sailing boat painting,brown boat,"Boat, Water transportation, Vehicle, Painting, Watercolor paint, Watercraft, Art, Boating","Transportation, Vehicle, Boat, Human, Person, Art, Painting","jolly boat, small boat, boat, watercraft, craft, vehicle, sampan skif, dugout canoe, sea green color","a small boat in a body of water, boat, water, outdoor, small, sitting, old, black, man, row, lake, body, people, white, parked, table, woman, floating, large, riding, bowl, group, standing, city, river, docked, snow"